Tiêu đề,Đường dẫn,Mô tả,Địa chỉ,Điện thoại,Email
Công Ty Du Lịch Thuận Hoá,dulichthuanhoa.com,Khoảnh Khắc Đáng Nhớ Của khách hàng · Đoàn trường THCS Phong Hải · Đoàn trường Mầm non Phong An II · Đoàn trường THCS Phú Xuân · Đoàn học sinh trường TH & THCS ...,,,
"Điều kiện, thủ tục thành lập công ty du lịch kinh doanh lữ hành",ketoananpha.vn,1. Bước 1 - Thủ tục thành lập công ty du lịch lữ hành · Giấy đề nghị đăng ký doanh nghiệp; · Điều lệ công ty; · Bản sao hợp lệ CMND/CCCD/hộ chiếu; · Quyết định ...,,,cskh@ketoananpha.vn
Công Ty Du Lịch Uy Tín Chất Lượng | Du lịch VNTOUR,vntour.com.vn,"CÔNG TY CỔ PHẦN VNTOUR. Chuyên cung cấp dịch vụ tour du lịch giá rẻ, làm visa, dịch vụ hồi hương, bán vé máy bay, các chương trình Nam Viet Tour và tổ chức sự ...",,0,info@vntour.com.vn
CÔNG TY DU LỊCH NON SÔNG VIỆT TIỀN GIANG,www.nonsongviettourist.com,"Du Lịch NON SÔNG VIỆT TIỀN GIANG luôn đảm bảo cho khách hàng chất lượng dịch vụ tốt, đa dạng, linh hoạt, giá cả hợp lý trên thị trường. Với chúng tôi, tiêu ...",,,nonsongviettravel@gmail.com
Vinacomin (VTTC ): Công ty cổ phần Du lịch và Thương mại,www.vttc.net.vn,"TẠI VITM HÀ NỘI 2025, VTTC TRAVEL - Tiếp tục được Hiệp hội Du lịch Việt Nam vinh danh trong Top "" Doanh nghiệp kinh doanh lữ hành nội địa tiêu biểu năm ... ...",,,
Tổng Lãnh sự quán Nhật Bản tại TP.HCM Consulate General of ...,www.hcmcgj.vn.emb-japan.go.jp,Tổng Lãnh sự quán Nhật Bản tại TP.HCM Consulate General of Japan in Ho Chi Minh City · QUY ĐỊNH VỀ VIỆC ĐĂNG KÝ ĐẠI DIỆN XIN VISA · ĐỐI VỚI CÁC CÔNG TY DU LỊCH.,,,
Oxalis Adventure • Công ty du lịch mạo hiểm hàng đầu Việt Nam,oxalisadventure.com,"Chúng tôi cung cấp các tour thám hiểm hang động hàng đầu thế giới tại Quảng Bình, Việt Nam. An Toàn: An toàn của du khách và nhân viên Oxalis là ưu tiên hàng ...",,,
Redriverco: Trang Chủ,redriverco.com,CÔNG TY TNHH DU LỊCH VÀ THƯƠNG MẠI SÔNG HỒNG. © Bản quyền Redriverco 2021. Kết nối với chúng tôi: GIỚI THIỆU CHUNG · LIÊN HỆ · ĐỐI TÁC · TUYỂN DỤNG · Chính sách ...,,,
Ngôi Sao Group,ngoisaotour.net,"Ngôi Sao Tour là đơn vị lữ hành uy tín tại TPHCM có hơn 14 năm kinh nghiệm, là công ty du lịch ở Việt Nam có tỉ lệ đậu Visa Mỹ thường xuyên trong nhiều năm.",,0,hotro@ngoisaotour.net
