Tiêu đề,Đường dẫn,Mô tả,Địa chỉ,Điện thoại,Email
Công ty Du Lịch VieTourist: tổ chức tour hàng đầu Việt Nam (VTD),www.vietourist.com.vn,Công ty Du Lịch VieTourist: tổ chức tour hàng đầu Việt Nam (VTD) Vietourist phấn đấu để luôn giữ vị trí là một trong những công ty du lịch hàng đầu của Việt ...,,0,info@vietourist.com.vn
Lửa Việt Tours | Trải Nghiệm Nhiều Hơn - Sống Trọn Vẹn Hơn,www.luavietours.com,"Lửa Việt Tours vinh dự thuộc Top 10 công ty du lịch hàng đầu tại TP. HCM. Chuyên tổ chức các tour trong nước, tour Nhật Bản, tour Châu Âu, tour Châu Úc,.",,0,info@luavietours.com
Du Lịch SaiGonNew | Du Lịch Chuyên Nghiệp Nhất,dulichsaigonnew.com,Chào mừng đến với CÔNG TY du lịch số 1 VIỆT NAM. DU LỊCH SAIGONNEW. Xem Ngay. Intro Công Ty · Khám Phá Biển đảo Đẹp Nhất Tại Việt Nam. Hơn 500 Chuyến Bay. Hơn ...,,,congtydulichsaigonnew@gmail.com
Du Lịch Việt Mỹ: Thương Hiệu Chuyên Tour Mỹ & Visa Mỹ,dulichvietmy.com,Top 10 Công Ty Làm Visa Nhật Bản Uy Tín Nhất Tại Việt Nam Việc xin visa Nhật Bản đòi hỏi.. cong-ty-du-lich-nhat-ban-uy-tin.,,0,
CÔNG TY TNHH CHÌA KHÓA DU LỊCH (TRAVEL KEY),chiakhoadulich.com,"chia khoa du lich, du lich my, visa my, du lich Canada, visa canada, my, hoa ky, canada.",,0,sales@chiakhoadulich.com
Du Lịch Văn Hóa Việt,www.dulichvanhoaviet.com.vn,"CÔNG TY TNHH DỊCH VỤ DU LỊCH VĂN HÓA VIỆT TRAVEL. 55B Nguyễn Thị Minh Khai, Phường Bến Thành, Quận 1, TPHCM. ĐT: (84-28) 3930.9717 - Fax: (84-28) 3930.9873.",,0,vanhoaviet@dulichvanhoaviet.com.vn
"Saigontourist - Du lich trong nuoc, Du lich nuoc ngoai, Ve may bay ...",www.saigontourist.net,"... Công ty TNHH Một Thành Viên Dịch vụ Lữ hành Saigontourist. 45 Lê Thánh Tôn, Quận 1, TPHCM. ĐT: (84-28) 38 279 279 - Fax: (84-28) 38 224 987. Số đăng ký kinh ...",,0,info@saigontourist.net
CÔNG TY CỔ PHẦN DU LỊCH QUỐC TẾ SAO BIỂN,saobientravel.com,TOUR TUYẾN Xem tất cả · BẮC KINH - THƯỢNG HẢI TÔ CHÂU - Ô TRẤN - HÀNG CHÂU 6N6Đ · THƯỢNG HẢI - TÔ CHÂU - HÀNG CHÂU - Ô TRẤN - LỤC GIA CHỦY 5N4Đ · THƯỢNG HẢI - ...,,0,seastartravel168@gmail.com
"Du lịch Hoàn Mỹ - Chuyên tour Mỹ cao cấp, tận tâm phục vụ",www.dulichhoanmy.com,Du lịch Hoàn Mỹ - chuyên tour du lịch Mỹ; định hướng dịch vụ 5*; phù hợp với nhu cầu khách hàng trung niên & gia đình có trẻ em; tỉ lệ đậu visa rất cao.,,,info@dulichhoanmy.com
CÔNG TY TNHH THƯƠNG MẠI VÀ DU LỊCH CAO NIÊN,www.dulichcaonien.vn,CÔNG TY TNHH THƯƠNG MẠI DU VÀ LỊCH CAO NIÊN.,,0,info@dulichcaonien.com
Danh sách các công ty du lịch được chỉ định của Việt Nam No ...,www.taiwanembassy.org,Danh sách các công ty du lịch được chỉ định của Việt Nam. No. Travel Agency. Contact Information. 1. VIETRAVEL. +84-8-38228898 https://www.vietravel.com/. 2.,,,
Quản lý lữ hành,quanlyluhanh.vn,CÔNG TY TNHH DU LỊCH LỮ HÀNH UNITOURIST. UNITOURIST TRAVEL SERVICE COMPANY LIMITED · CÔNG TY TNHH DU LỊCH VÀ LỮ HÀNH C-STAR. C-STAR TRAVEL AND TOURS COMPANY ...,,,
"Vietravel - Đặt tour du lịch, vé máy bay, khách sạn online",travel.com.vn,"TOUR TRUNG QUỐC TRONG TẦM TAY, BOOK NGAY! Trang WEB sử dụng cookies. Chúng tôi sử dụng cookies hoặc các công nghệ tương tự để nâng cao trải nghiệm trình ...",,,
Du lịch trong nước - Công ty Du Lịch Triều Hảo,www.trieuhaotravel.vn,Chương trình Du Lịch Trong Nước với nhiều điểm du lịch mới: Du Lịch Trong Nước khởi hành từ Tp. Hồ Chí Minh. Dưới dây là các Tour Du Lịch Trong Nước giá tốt ...,,0,info@trieuhaotravel.vn
CÔNG TY TNHH DU LỊCH QUỐC TẾ TRÀNG AN - 024.66.700.700,trangantravel.com,CHÙM TOUR CHÂU ÂU. Đông Âu. 16 Sản phẩm · Nam Âu. 3 Sản phẩm · CHÙM TOUR TRUNG QUỐC. -2%. Châu Á. TOUR TÂY AN – LẠC DƯƠNG – TRỊNH CHÂU 7N6Đ – BAY THẲNG VIETJET ...,,0,sm@trangantravel.com.vn
Du Lịch Việt: Mạng bán TOUR DU LỊCH trực tuyến hàng đầu Việt nam,dulichviet.com.vn,"DU LỊCH VIỆT là Công ty DU LỊCH chuyên tổ chức các TOUR DU LỊCH trong nước và các TOUR DU LỊCH nước ngoài chuyên nghiệp, uy tín. DU LỊCH VIỆT Tự hào là mạng ...",,,
Hanoitourist - Thương hiệu du lịch uy tín từ 1963 | Hanoitourist ...,hanoitourist.vn,Secondary Menu. Tin tức · Giới thiệu · Về công ty · Giải thưởng · Liên hệ · Đăng ký đại lý · Nhà · Tour trong nước. Toggle submenu. Du lịch Miền Bắc.,,0,
DANH SÁCH CÁC DOANH NGHIỆP KINH DOANH DỊCH VỤ LỮ ...,sodulich.ninhbinh.gov.vn,"Công ty TNHH Du lịch và Sự kiện Tam Sinh, Phạm Hồng Biên, Số 92 Hùng Vương, phường Nam Bình, thành phố Hoa Lư, tỉnh Ninh Bình, 0985216455, 37-0023/2023/SDL-GP ...",,,sodulich@ninhbinh.gov.vn
Công ty Du Lịch Triều Hảo,trieuhaotravel.vn,Du lịch trong nước · Du Lịch Đảo Ngọc Phú Quốc (2025) · Du Lịch Miền Bắc: Hà Giang - Cao Bằng (2025) · Du Lịch Miền Bắc: Hà Nội – Hà Giang – Sapa – Fansipan ( ...,,0,info@trieuhaotravel.vn
Tour du lịch trong nước và nước ngoài - Việt Nam TravelMart,vietnamtravelmart.com.vn,Tour du lịch Việt Nam du lịch nước ngoài. Tour du lịch Việt Nam & du lịch nước ngoài. CÔNG TY DU LỊCH VIỆT NAM TRAVELMART. HOTLINE: 1800 1735. Tiếng Việt ...,,0,info@vntm.com.vn
Công ty Cổ phần ĐT TM DV Du lịch Đất Việt - Trang chủ,datviettour.com.vn,Công ty Cổ phần ĐT TM DV Du lịch Đất Việt · Tour Hot Giờ Chót - Book tour ngay! Giá rẻ trong ngày · Tour nước ngoài - Tour trọn gói bay khứ hồi · Tour Xe Trong ...,,0,sales@datviettour.com.vn
Danh sách 10 công ty du lịch Đà Nẵng 'hàng đầu' 2025 - DANAGO ...,danago.com.vn,"Aug 7, 2024 ... TOP 10 CÔNG TY DU LỊCH ĐÀ NẴNG UY TÍN NHẤT · 1. CÔNG TY CỔ PHẦN DU LỊCH DANAGO · 2. CÔNG TY DU LỊCH VIETRAVEL – CHI NHÁNH ĐÀ NẴNG · 3. SÀI GÒN ...",,0,danago@dng.vn
Pan American Travel - Công ty cổ phần Du lịch Châu Mỹ,pantravel.vn,"HÀNH TRÌNH MƠ ƯỚC HƠN VẠN ƯỚC MƠ · AM HIỂU CHÂU MỸ. Liên tục thực địa, khảo sát Châu Mỹ, Châu Âu. Am hiểu điểm đến và văn hoá bản địa. · TIÊN PHONG MỞ LỐI. Tiên ...",,0,cskh@pan-american.vn
TOP 10 các công ty du lịch uy tín Việt Nam update 2025,pystravel.vn,"Mar 18, 2025 ... TOP 10 các công ty du lịch uy tín Việt Nam update 2025 · Công ty Cổ phần du lịch và tiếp thị giao thông vận tải Vietravel · 2. Công ty TNHH du ...",,0,contact@pystravel.com
Viet Viet Tourism,vietviettourism.com,Công Ty CP Đầu Tư Quốc Tế Và Du Lịch Việt Việt. GP Lữ Hành Quốc Tế: GP79 – 1075/2019/TCDL-GP LHQT; GPKD: 0311216033 Do Sở KHĐT TPHCM Cấp; Trụ sở chính: 290/13A ...,,0,
THÔNG BÁO : Danh sách các công ty du lịch mới nộp hồ sơ tại ...,www.visaforchina.cn,"Jan 23, 2024 ... Kể từ ngày 14 – 08 - 2023, các công ty du lịch có tên sau đây được thay mặt người xin thị thực nộp hồ sơ và nhận kết quả xin thị thực Trung ...",,,
Công Ty Du Lịch Hành Hương Quốc Tế Hoa Sen,hanhhuonghoasen.com.vn,"Không những vậy Công Ty Du Lịch Hoa Sen cũng trở thành một trong những thương hiệu du lịch hàng đầu Việt Nam về Du lịch Tâm Linh, Du Lịch Cao cấp, Du lịch Quốc ...",,0,hanhhuonghoasen@gmail.com
NAM HÙNG TOURIST: CÔNG TY DU LỊCH NAM HÙNG,www.namhungtourist.com,Công ty du lịch Nam Hùng - Nam Hùng Tourist · HÀ NỘI - BANGKOK - PATTAYA - M2 TẾT BAY VIETJET- 30/1/2025 · HÀ NỘI - BANGKOK - PATTAYA - M2 TẾT BAY AIRASIA ...,,,tour-deprt@namhungtourist.com
Công Ty Du Lịch HT Việt Nam | Chuyên Tour Du Lịch Trong Nước ...,dulichht.vn,Tour Khuyến Mãi Tết · TOUR LAGI - MŨI NÉ 3 NGÀY 2 ĐÊM · TOUR LAGI 3 NGÀY 2 ĐÊM · TOUR NINH CHỮ - VỊNH VĨNH HY 3 NGÀY 2 ĐÊM · TOUR CHÂU ĐỐC - CẦN THƠ 4 NGÀY 3 ...,,0,phongkinhdoanh@dulichht.vn
CÔNG TY TNHH DU LỊCH PHIÊU LƯU VIỆT,www.vietadventure.com.vn,Tour Hot · Đã Nẵng - Sơn Trà - Bà Nà - Hội An - Huế - Quảng bình (5N4Đ) · Hàn Quốc: Seoul - Everland - Đảo Nami (5N4Đ) · ĐÀ NẴNG - THÀNH ĐÔ - CỬU TRẠI CÂU - ...,,,info@vietadventure.com.vn
Công ty Du lịch ABC | Tour Du lịch Trong và Ngoài Nước Giá Rẻ,dulichabc.vn,Công ty Du Lịch ABC - Top 10 thương hiệu dẫn đầu Việt Nam. Chuyên tổ chức Tour Trong và Ngoài Nước Giá Rẻ. Hotline: 0888 23 1111.,,0,dulichabc.vn@gmail.com
Cholontourist: Công ty Cổ phần Dịch vụ Du lịch Chợ Lớn,cholontourist.com.vn,"Công ty CP DV Du lịch Chợ Lớn - Top 10 công ty du lịch lữ hành tốt nhất Việt Nam. Tổ chức tour du lịch trong và ngoài nước, đặt phòng khách sạn, vé máy bay.",,,
Huong Giang Tourist: Home - Video,www.huonggiangtourist.com,Huong Giang Tourist Joint Stock Company was founded in 1994 and major activities are: Hotel; Restaurant; Domestic and International Travel; ...,,,info@huonggiangtourist.com
"Công ty Thế Hệ Mới | Tư vấn visa du học, du lịch, định cư - Trang chủ",www.thm.vn,"Công ty Thế Hệ Mới chuyên tư vấn visa du học, du lịch, định cư. Đội ngũ chuyên viên đạt chứng chỉ quốc tế, nhiều kinh nghiệm và đã được huấn luyện tại Mỹ, ...",,,info@thm.vn
"Danh Sách 20 Công Ty Du Lịch Đà Nẵng ""Bậc Nhất"" 2025",dng.vn,OPENTOUR - CÔNG TY LỮ HÀNH ĐÀ NẴNG · Tên doanh nghiệp: CÔNG TY TNHH MTV DỊCH VỤ DU LỊCH ĐÀ NẴNG OPEN TOUR · Mã số doanh nghiệp: 0401886804 · Địa chỉ trụ sở: Lô ...,,0,danago@dng.vn
Viet Sun Travel - Tận Hưởng Giá Trị Cuộc Sống,vietsuntravel.com,Viet Sun Travel tự hào là một trong những đơn vị Lữ Hành Chuyên Nghiệp tại Việt Nam. Với kinh nghiệm 21 năm trong lĩnh vực tổ chức các Tour du lịch trong ...,,0,info@VietSunTravel.com
CÔNG TY TNHH THƯƠNG MẠI DU LỊCH LIÊN BANG | Du lịch Liên ...,lienbangtravel.com,"Du lịch Liên Bang là nhà điều hành tour du lịch chuyên nghiệp, chúng tôi có nhiều năm kinh nghiệm trong việc tổ chức tour du lịch trong nước và quốc tế.",,0,info@lienbangtravel.com
CÔNG TY CỔ PHẦN DỊCH VỤ DU LỊCH & THƯƠNG MẠI TST (TST ...,www.tsttourist.com,"TSTtourist - Top 10 Công ty lữ hành hàng đầu Việt Nam, chuyên tổ chức tour du lịch trọn gói cho cá nhân, doanh nghiệp, tour tự chọn chất lượng cao ở trong ...",,0,info@tsttourist.com
Deluxe Travel – Houston's Leading Vietnamese American Travel ...,www.dtravel.net,Hãy tìm kiếm kỳ nghỉ theo mơ ước của bạn với Deluxe Travel - công ty du lịch Việt-Mỹ hàng đầu ở Houston. Find your next dream vacation with Deluxe Travel ...,,,deluxetravelhouston@gmail.com
Công Ty Du Lịch Thanh Thanh,www.facebook.com,Giá tour trọn gói chỉ từ 16.990.000 VNĐ/khách (phòng Interior – không cửa sổ) 19.190.000 VNĐ/khách (phòng Oceanview – có cửa sổ) 20.990.000 VNĐ/khách (phòng ...,,,
Vietravel - Nhà Tổ Chức Du Lịch Chuyên Nghiệp,www.vietravel.com,"... công ty lữ hành hàng đầu khu vực Đông Nam Á vào năm 2015 ... Vào ngày 3/6/2024 tại Đà Nẵng, Công ty Du lịch Vie ... Tin du lịch. Vietravel ...",,0,
Hội An,www.hoiantourist.com,Hoi An Beach Resort được vinh danh tại VITA Awards 2025. Khu nghỉ dưỡng Hoi An Beach Resort (thuộc Công ty CP Du lịch – Dịch vụ Hội An) vừa được vinh danh là “ ...,,,
Du lịch Nam Phương Caravan & Teambuilding - NP Tour - Du Lịch ...,namphuongtourist.com,"CÔNG TY DU LỊCH NAM PHƯƠNG 263/11 Nguyễn Văn Đậu, Phường 11, Quận Bình ... @ Bản quyền 2006 - 2017 thuộc về Công ty Du Lịch Nam Phương. Thiết kế web ...",,,info@namphuongtourist.com
Du lịch Hòa Bình - peacetour,peacetour.com.vn,Du lịch Hòa Bình - Nhà tổ chức du lịch chuyên nghiệp. Website peacetour.com.vn tự hào là mạng bán tour du lịch trực tuyến hàng đầu tại Việt Nam.,,0,peacetour@hcm.vnn.vn
Công Ty Lữ Hành Là Gì? Loại Hình Doanh Nghiệp Lữ Hành?,dulichsaigon.edu.vn,Công ty lữ hành (Tour Operator) là khái niệm chỉ một đơn vị chuyên cung cấp các dịch vụ liên quan đến việc tổ chức và quản lý chương trình du lịch hoàn chỉnh ...,,0,tuvantuyensinh.dlsg@gmail.com
Top 20 công ty du lịch uy tín hàng đầu Việt Nam năm 2025,maisonoffice.vn,Top 20 công ty du lịch uy tín hàng đầu Việt Nam năm 2025 · Công ty Cổ phần Việt Nam Booking · Công ty Cổ phần Vietravel · Công ty TNHH Du lịch PYS · Công ty du ...,,,info@maisonoffice.vn
Vietmytravel: 17 Năm Chuyên Tour Mỹ – Canada – Úc – Châu Âu,vietmytravel.com,"Việt Mỹ Travel: Công Ty Du Lịch Việt Mỹ với hơn 17 Năm Chuyên Tour & Visa Mỹ – Canada – Úc – Châu Âu, Land Tour du lịch Mỹ - Canada - Úc tại Việt Nam.",,0,info@vietmytravel.com
CÔNG TY CỔ PHẦN DU LỊCH ĐỒNG THÁP: Trang chủ,dongthaptourist.com,Dongthap Tourist là đơn vị chuyên cung cấp các dịch vụ : Doanh nghiệp lữ hành Quốc tế duy nhất tại Đồng Tháp có thương hiệu trên 30 năm...,,0,ttdhdldongthap@gmail.com
CÔNG TY CỔ PHẦN DU HỌC DU LỊCH TÂN ĐĂNG QUANG,tandangquang.com,Du học du lịch Tân đăng quang · 091.8283.549 info@tandangquang.com · Tư vấn qua Skype · 0907.990.459 dtquyen@tandangquang.com · Tư vấn qua Skype · 0986.200.834,,,
Công Ty Du Lịch Vietrend Travel - Hơn Cả Một Chuyến Đi,vietrendtravel.com,"Công ty TNHH Du lịch và Dịch Vụ Vietrend - Vietrend Travel, đơn vị lữ hành chuyên nghiệp, uy tín lâu năm, tổ chức tour du lịch trong và ngoài nước.",,0,info@vietrendtravel.com
Trang chủ | Saigontourist | Tận hưởng bản sắc Việt,www.saigontourist.com.vn,"SAIGONTOURIST GROUP ĐẶT MỤC TIÊU NĂM 2025 ĐÓN 2,3 TRIỆU LƯỢT KHÁCH. Vào ngày 11/6/2025, tại Khu du lịch Văn Thánh, Tổng Công ty Du lịch Sài Gòn (Saigontourist ...",,,
VATC - Công ty Cổ phần Du lịch Hàng không Việt Nam (VATC),vatc.vn,Công ty Cổ phần Du lịch Hàng không Việt Nam · 124 · 84 · 12 · 30. Kinh doanh thương mại. Đối tác của chúng tôi. doi-tac-3 · doi- ...,,,
Top 25 công ty du lịch giá rẻ uy tín hàng đầu hiện nay tại Việt Nam,www.vietnambooking.com,"Mar 11, 2024 ... Top 25 công ty du lịch giá rẻ, uy tín hàng đầu hiện nay tại Việt Nam · Công ty du lịch giá rẻ - Fiditour · Công ty du lịch giá rẻ - Hanoitourist.",,,
"Top 15 Công Ty Du Lịch Đà Nẵng ""đáng chọn"" 2025",danago.vn,TOP 15 CÔNG TY DU LỊCH ĐÀ NẴNG ĐÁNG CHỌN NHẤT 2025 · CÔNG TY CỔ PHẦN DU LỊCH DANAGO · CÔNG TY DU LỊCH VIETRAVEL - CHI NHÁNH ĐÀ NẴNG · CÔNG TY CỔ PHẦN DỊCH VỤ DU ...,,0,danago@dng.vn
PhuThoTourist - CÔNG TY CỔ PHẦN DỊCH VỤ DU LỊCH PHÚ THỌ,phuthotourist.vn,Home · Giới thiệu · Privacy Policy · Chính sách bảo mật · Các đơn vị · CVVH Đầm Sen · KDLST Vàm Sát · Khách sạn Ngọc Lan · Khách sạn Phú Thọ ...,,,
Công Ty Du Lịch Gotravel | Tour Du Lịch Giá Tốt,gotravel.vn,"Chuyên tổ chức các tour du lịch trong nước và quốc tế, đặt vé máy bay, đặt phòng khách sạn, cho thuê xe, giá tốt nhất thị trường, liên hệ để nhận báo giá ưu ...",,0,info@gotravel.vn
Công ty du lịch Saigontimes Travel,saigontimestravel.com,"Công ty du lịch Saigontimes Travel chuyên cung cấp tour du lịch nước ngoài (Thái Lan, Nhật Bản, Đài Loan, Hàn Quốc, Trung Quốc, Châu Âu,...)",,0,info@saigontimestravel.com
Công Ty Du Lịch Sông Công | Website chính thức | Official Website,www.songcongtravel.vn,Công Ty Du Lịch Sông Công (Mã Số Thuế: 0107429722 thành lập từ năm 2016) - Tiền thân là Song Cong Air Travel thành lập năm 2015 Tự hào là đơn vị đi đầu ...,,0,cskh@songcongtravel.vn
Công ty TNHH Liên hợp Vận tải & Du lịch VITRACO,vitraco.vip,"công ty TNHH Vận tải & Du lịch vitraco · Được thành lập từ năm 2003, trải qua 22 năm hình thành và phát triển. · Tự hào với hơn 200 xe cao cấp đa dạng từ 4 đến ...",,,vitraco@vitraco.vip
Tour Du Lịch Việt Nam - Chuyên tour trong nước và quốc tế giá tốt ...,tour.dulichvietnam.com.vn,"Tour Du Lịch Việt Nam - Chuyên trang tổng hợp tour du lịch trong nước, quốc tế uy tín Việt Nam, giá luôn tốt nhất.",,0,
Flamingo Redtours - Top 10 Công ty du lịch hàng đầu Việt Nam,thegioidulich.com.vn,Du lịch nước ngoài · ĐỨC - HÀ LAN - BỈ - LUXEMBOURG - PHÁP · KHÁM PHÁ HỒ BAIKAL – MÙA BĂNG XANH · Khám phá nước Nga I Saint Peterburg - Moscow 9 Ngày 8 đêm ...,,0,
Công ty CP Du Lịch Việt Nam VITOURS,vitours.com.vn,Tour trong nước · Image · Phương tiện: Ô tô. Khởi hành: Đang cập nhật. Giá:1.290.000 (VNĐ) · Chi tiết Hỏi tour · BÀ NÀ · Image. HOT. Phương tiện: Ô tô. Khách ...,,,
"BestPrice: Đặt vé máy bay, tour du lịch, khách sạn giá rẻ nhất",www.bestprice.vn,... Công ty du lịch hàng đầu Việt Nam. 99% khách hàng hài lòng. Vé máy bay · Khách sạn ...,,0,
AD Luxury Travel - Công ty du lịch chuyên tour chất lượng cao,adluxury.net,AD Luxury Travel: Tiên phong trong thị trường du lịch cao cấp tại Dubai. (PLO)- Dubai là điểm đến du lịch được nhiều du khách Việt lựa chọn. AD Luxury Travel đã ...,,,info@adluxury.net
"Japan Dream Tour Co., Ltd. | Công ty du lịch chuyên bán tour tạo ...",japandreamtour.com,"Công ty du lịch chuyên bán tour tạo cảm nhận mới về Nhật Bản Japan Dream Tour Co., Ltd. · お客様相談室 · Tin tức mới · Lĩnh vực kinh doanh · Thông tin tuyển ...",,,
Saigon Star Travel | Công Ty Du Lịch Uy Tín & Chuyên Nghiệp,saigonstartravel.com,"Thành lập 08/2011, Saigon Star Travel tự hào là đơn vị lữ hành uy tín với hơn một thập kỷ đồng hành cùng khách hàng. Nhiều năm liền vinh dự đạt các danh hiệu “ ...",,0,info@saigonstartravel.com
Công ty lữ hành,dulichbinhdinh.com.vn,"May 20, 2017 ... 4, Cty TNHH MTV Hoàng Mi, Thôn Lý Hưng, xã Nhơn Lý ; 5, Công ty TNHH Lữ hành Quang Minh, 407 Nguyễn Huệ - Tp Quy Nhơn ; 6, Công ty TNHH DV DL Bách ...",,,
TRISEDCO | CÔNG TY CỔ PHẦN ĐẦU TƯ DU LỊCH VÀ PHÁT ...,trisedco.com,"* Là một nhà sản xuất và cung cấp bột cá, mỡ cá cho ngành chăn nuôi gia cầm và thủy sản đứng hàng đầu Việt Nam và thị trường quốc tế.",,+84,
Vietjetours – Công Ty Du Lịch Việt Jet,vietjetours.vn,"""Hướng dẫn viên Tour Thái rất ok, kiến thức rộng, nói chuyện vui, hóm hỉnh. Khách sạn ở Thái Lan rất tuyệt vời. Mình sẽ lựa chọn Vietjetours cho những chuyến đi ...",,0,dulichvietjet@gmail.com
HANOI TRAVEL-Công ty Lữ Hành Hà Nội-174A Đội Cấn nhà tổ ...,www.luhanhhanoi.com.vn,Tour trong nước · Du lịch Phú Quốc Trọn Gói 4 Ngày · Du lịch Sapa - Moana - Cầu Kính - Fansipan - Chợ Bắc Hà · Du lịch Miền Trung 4 Ngày: Đà Nẵng - Hội An - Huế.,,0,info@hanoitravels.com.vn
Công ty du lịch S-Tours - Trải nghiệm và cảm nhận,stours.vn,"Với đội ngũ nhân viên chuyên nghiệp được đào tạo nhiều kỹ năng nghiệp vụ và sức trẻ nhiệt huyết, qua hơn 7 năm hoạt động trong thị trường ngành du lịch, công ty ...",,,stours.vn@gmail.com
VNTravel – Công Ty Cổ Phần Du Lịch Việt Nam Vntravel,vntravelgroup.vn,VNTravel được biết đến. VNTravel là một trong những tập đoàn đứng đầu Đông Nam Á về du lịch trực tuyến và các dịch vụ liên quan. Sứ mệnh của VNTravel là mang ...,,0,
Phú Quốc Travel - Công ty du lịch Phú Quốc hàng đầu,phuquoctravel.vn,CÔNG TY DU LỊCH PHÚ QUỐC – PHÚ QUỐC TRAVEL · THƯƠNG HIỆU UY TÍN. Duy trì TOP 10 thương hiệu du lịch uy tín nhất Phú Quốc 6 năm liền từ 2016 – 2017 – 2018 – 2019 ...,,0,luhanhdaophuquoc@gmail.com
CÔNG TY DU LỊCH VIETLIKE TRAVEL,vietliketravel.vn,"Hà Nội - Vịnh Hạ Long - Hang Sửng Sốt - hang Luồn - Đảo TiTop - bãi tắm TiTop - Chợ Đêm, Phố ẩm thực - Yên Tử - Tháp tổ - chùa Hoa Yên - chùa Một Mái - chùa ...",,,info@vietliketravel.com
Du Lịch Độc Đáo – Teambuilding Huấn Luyện & Xây Dựng Văn Hóa ...,dulichdocdao.net,Bản Quyền : thuộc CÔNG TY CP TẬP ĐOÀN UNTRA GROUP.,,0,info@dulichdocdao.net
CÔNG TY CP THƯƠNG MẠI DỊCH VỤ DU LỊCH 360GO,360go.com.vn,"CÔNG TY CỔ PHẦN THƯƠNG MẠI DỊCH VỤ DU LỊCH 360GO. Với nhiều năm kinh nghiệm trong lĩnh vực du lịch. 360Go đã phát triển mạnh và cung cấp, tổ chức các Combo, ...",,0,kinhdoanh@360go.com.vn
Công Ty Lữ Hành Tổ Chức Tour Du Lịch Uy Tín Chất Lượng Tại Hồ ...,intour.vn,"INTOUR TRAVEL & CHI NHÁNH. INTOUR là Công Ty Lữ Hành Tổ Chức Tour Du Lịch Uy Tín Chất Lượng Tại Hồ Chí Minh và toàn quốc. Tổ chức sự kiện, vé máy bay, cho thuê ...",,0,
Camellia Tours Vietnam – Công ty du lịch dẫn đầu về chất lượng ...,camelliatours.vn,"Camellia Tours Vietnam – Công ty du lịch dẫn đầu về chất lượng dịch vụ và giá cả, chuyên gia tư vấn tour trong nước, tour nước ngoài, các dịch vụ về hội thảo, ...",,0,info@camelliatours.vn
Visa nhập cảnh Nhật Bản | Đại sứ quán Nhật Bản tại Việt Nam,www.vn.emb-japan.go.jp,"Jul 1, 2024 ... Đại sứ quán chỉ định các các công ty du lịch tại Việt Nam và các công ty đại diện xin visa đáp ứng đủ các điều kiện nhất định làm công ty ủy ...",,,
Trang chi tiết - Trang thông tin điện tử Sở Du lịch,sdl.kiengiang.gov.vn,"STT, TÊN DOANH NGHIỆP, ĐỊA CHỈ, LIÊN HỆ. ĐIỆN THOẠI, EMAIL. 1, CÔNG TY TNHH TM DV DU LỊCH RẠCH GIÁ, 316A Ngô Quyền, phường Vĩnh Lạc, thành phố Rạch Giá ...",,,
Top 25 công ty du lịch uy tín hàng đầu tại Hà Nội - Update năm 2025,thienthanhtravel.com,"Dec 23, 2024 ... Đứng đầu trong danh sách công ty du lịch nào uy tín nhất hiện nay phải kể đến HoaBinh Tourist – đơn vị lữ hành được nhiều doanh nghiệp và khách ...",,0,thienthanhtravelhn@gmail.com
Công ty du lịch Tugo,tugo.vn,"Về chúng tôi · Công ty du lịch Tugo được thành lập từ năm 2015, đến nay Tugo đã có hơn 7 năm kinh nghiệm tổ chức tour du lịch hướng đến các thị trường cao cấp ...",,0,support@tugo.com.vn
PACIFIC TRAVEL - CHUYÊN TOUR THÁI LAN GIÁ RẺ,dulichthai.com,Công Ty Du Lịch Pacific Travel là công ty chuyên tổ chức tour Thái Lan. Với đội ngũ nhân viên và hướng dẫn viên du lịch kinh nghiệm lâu năm cùng với hệ thống ...,,0,
Công Ty Du Lịch Travel One,travelone.vn,"Travel One là thành viên của Tập đoàn Fly One Investment (FIC), chuyên cung cấp tour du lịch trọn gói trong nước và quốc tế, đặc biệt nổi bật với các dịch vụ ...",,0,info@travelone.vn
Stravel - Công Ty Du Lịch Duyên Dáng Việt - Team Buidling - Event ...,stravel.vn,"Stravel – Công ty du lịch Duyên Dáng Việt – công ty tổ chức team building, tổ chức sự kiện, đào tạo nhân viên và huấn luyện nhân viên.",,,linh.ngo@stravel.vn
Du Lịch Bến Nghé | Công ty du lịch uy tín TPHCM,dulichbennghe.vn,"Visa. Dịch vụ Visa nhanh, rẻ. Visa trọn gói, thủ tục đơn giản. Thuê xe. Dịch vụ thuê xe giá tốt từ các nhà xe uy ...",,0,info@bennghe.vn
Thông báo 목록 | Tổng Lãnh sự quán Đại Hàn Dân Quốc tại Thành ...,overseas.mofa.go.kr,DANH SÁCH CÔNG TY ƯU TIÊN (VISA DU LỊCH)-10.03.25. 첨부파일. 주 호치민 총영사관. 2025-03-03. 43. HƯỚNG DẪN KHAI BÁO NHẬP CẢNH (HÀN QUỐC) ĐIỆN TỬ. 첨부파일. 주 ...,,,
VINTOURS CÔNG TY DU LỊCH VÀ SỰ KIỆN,vintours.vn,"Khám phá Pù Luông, Huế và những lợi ích tuyệt vời từ du lịch chữa lành ngay hôm nay! ... Dịch vụ tổ chức sự kiện không đắt nếu chọn đúng đơn vị! Vin Tour & Event ...",,0,info@vintours.vn
Viettourist - Du Lịch Cao Cấp Giá Rẻ Đầu Tiên Tại Việt Nam,viettourist.com,"Cty CP DV TM Du Lịch Viettourist ... - NỘI DUNG: thanh toán tiền tour...,ngày đi tour..., tên người đi... Lưu ý: Công ty chỉ sử dụng 01 tài khoản ngân hàng duy ...",,0,viettourist@icloud.com
Mã tour - Du lịch nước ngoài,benthanhtourist.com,"LIÊN HỆ. CÔNG TY CỔ PHẦN DỊCH VỤ DU LỊCH BẾN THÀNH (BENTHANH TOURIST) Trụ sở: 70 Lý Tự Trọng, P. Bến Thành, Quận 1, TP. Hồ Chí Minh Tel: 028.35202020. Trung tâm ...",,,
